{
  "schemaVersion": "1.0.0",
  "artifactType": "intent_review",
  "id": "intent-review-issue-603",
  "issue": 603,
  "timestamp": "2026-07-30T05:17:13Z",
  "reviewedBy": "intent-review skill",
  "fixedPoint": "",
  "spec_fidelity": "pass",
  "specFidelityNotes": "",
  "smells": [],
  "convention_notes": [],
  "phaseRunId": "603-20260730T0516Z"
}
