{
  "schemaVersion": "1.0.0",
  "artifactType": "intent_review",
  "id": "intent-review-issue-586",
  "issue": 586,
  "timestamp": "2026-07-29T08:57:20Z",
  "reviewedBy": "intent-review skill",
  "fixedPoint": "7f0065a1",
  "spec_fidelity": "pass",
  "specFidelityNotes": "DVR-A2 diff replaces Home destination Unicode glyphs (\u2713, \u2197) with Lucide ClipboardCheck and BarChart3 via new DestinationIcon exported from @juli/ui. Demo Home wires mock-data icon keys to DestinationIcon; styles use ADR-015 tokens. Exactly two launchers (Decisions, Analytics) preserved. In Progress, Settings, Recommendations surfaces untouched.",
  "smells": [],
  "convention_notes": [
    {
      "standard": "ADR-015 token alignment",
      "path": "packages/ui/styles.css",
      "note": "Destination icon SVG uses var(--juli-primary-strong) via .juli-destination-icon; container retains primary-soft background.",
      "blocksMerge": false
    },
    {
      "standard": "packages/ui import boundary",
      "path": "packages/ui/src/destination-icons.tsx",
      "note": "Lucide icons folded into @juli/ui; apps/demo consumes exported DestinationIcon rather than page-level shadcn scaffolding.",
      "blocksMerge": false
    }
  ],
  "phaseRunId": "586-20260729T090000Z"
}
