{
  "schemaVersion": "1.0.0",
  "artifactType": "intent_review",
  "id": "intent-review-issue-606",
  "issue": 606,
  "timestamp": "2026-07-30T06:45:43Z",
  "reviewedBy": "intent-review skill",
  "fixedPoint": "ffafb255",
  "spec_fidelity": "pass",
  "specFidelityNotes": "Diff ffafb255..HEAD implements CDP-A0-5 (#606): gold.kpi_envelopes table keyed by shop_id with computed_at, envelope_version, payload jsonb (kpis map); migrates kind=analytics rows from public.analytics_kpi_envelopes; exposes analytics_kpi_envelopes_compat view preserving payload.kpis; GRANT SELECT + RLS on gold; trigger blocks legacy table writes (no parallel SoT). GoldKpiEnvelopesRepo + compat AnalyticsKpiEnvelopesRepo redirect writers/readers to gold. Honest unavailable ADR-044 five-key shell helper for seed path. No five-KPI precompute, no Partner calls, no Demo UI edits. down_revision=021_medallion_schemas per parallel tip note.",
  "smells": [],
  "convention_notes": [
    {
      "standard": "ADR-046 Q3 \u2014 shop_id PK",
      "path": "backend/src/juli_backend/models/models.py",
      "note": "GoldKpiEnvelope uses shop_id primary key without kind column \u2014 matches serving contract.",
      "blocksMerge": false
    }
  ],
  "phaseRunId": "606-20260730T132400"
}
